{
  "eventId": "7b6f3c1e-2a4d-4f0b-9c8e-1d2e3f4a5b6c",
  "eventType": "BankCharge",
  "version": 1,
  "occurredAt": "2026-10-18T09:30:00Z",
  "tenantId": "00000000-0000-0000-0000-000000000001",
  "traceId": null,
  "payload": {
    "transactionId": "3f2a1b0c-9d8e-4f7a-8b6c-5d4e3f2a1b0c",
    "walletId": "a1b2c3d4-e5f6-4a7b-8c9d-0e1f2a3b4c5d",
    "amountMinor": 500000,
    "currency": "VND"
  }
}
